{
  "indexVersion": 1,
  "manifestVersion": 1,
  "generatedAt": "2026-10-29",
  "source": "https://github.com/xysy92ds/ElysiaFloat",
  "trustPolicy": "repository-source-not-security-guarantee",
  "plugins": [
    {
      "id": "com.elly.market.text-tools",
      "name": "文本处理示例",
      "version": "1.0.0",
      "author": "ElysiaFloat",
      "description": "无外部权限的文本统计与规范化示例，适合验证插件开发流程。",
      "manifest": "plugins/com.elly.market.text-tools/manifest.json",
      "docs": "plugins/com.elly.market.text-tools/README.md",
      "permissions": [],
      "trust": "repository-source",
      "reviewStatus": "self-published",
      "sha256": "325326ebd5ad2778bc131931576c36e1dbd3443d94b32d46d0ca96385c76585e"
    },
    {
      "id": "com.elly.market.minecraft",
      "name": "Minecraft 联机助手",
      "version": "0.3.1",
      "author": "ElysiaFloat",
      "description": "让 AI 陪你玩 Java 版 Minecraft：Termux 里常驻 Mineflayer bot，支持离线登录、移动、挖掘、放置、攻击、跟随、聊天、状态快照与动作审计。",
      "manifest": "plugins/com.elly.market.minecraft/manifest.json",
      "docs": "plugins/com.elly.market.minecraft/README.md",
      "permissions": [
        "runtime.termux",
        "dependencies.manage",
        "network.local"
      ],
      "trust": "repository-source",
      "reviewStatus": "self-published",
      "sha256": "3de5f7dd09f6dc87efa22e0d83e85c2a1f31acd7bb810d6801c9e296dfca5812"
    }
  ]
}
